id,legislative_session:number,start_date,item:title,item:number,motion:title,
14008,14,2013-09-02,různé,7,Kdo souhlasí s přijetím uvedené dotace a jejím kofinancováním z vlastního rozpočtu,
14009,14,2013-09-02,různé,7,"Kdo souhlasí s prodejem uvedeného pozemku za cenu 350,— Kč/m2 v rozsahu podle skutčného stavu a s úhradou nákladů, spojených s převodem, žadatelem",
14010,14,2013-09-02,různé,7,"Kdo souhlasí se směnou částí pozemků č. 177/9 a 177/17 podle předloženého návrhu a s úhradou nákladů, spojených s převodem, žadatelem",
14011,14,2013-09-02,různé,7,Kdo souhlasí s poskytnutím finančního příspěvku „Letohrádku Vendula' do výše 50 tis. Kč?,
14012,14,2013-09-02,usnesení a závěr,9,Kdo souhlasí s navrženým usnesením,
15001,15,2013-09-23,program,1,hlasování o programu,
15002,15,2013-09-23,PROJEDNÁNÍ A SCHVÁLENÍ VÝSLEDKŮ VÝBĚROVÉHO ŘÍZENÍ NA ZHOTOVITELE „IZOLAČNÍ ZELEŇ TOSKÁNKA,2,"Kdo souhlasí, zda předběžně odsouhlasujeme výsledek výběrového řízení s tím, že zastupitelstvo pověřuje radu obce, aby ho definitivně potvrdila",
15003,15,2013-09-23,SOUHLAS S PŘEVODEM POZEMKŮ OD ŘSD PRO ZŘÍZENÍ CHODNÍKŮ TOSKÁNKA,3,"Kdo souhlasí, abychom převod částí pozemků od ŘSD zrealizovali?",
15004,15,2013-09-23,různé,4,"Kdo souhlasí, s odkoupením pozemků p.č. 11/14, 284/8 a 284/11 za cenu 117.410,— Kč od pana Kysaly?",
15005,15,2013-09-23,různé,4,Kdo souhlasí s dělením pozemku bývalé polní cesty p.č. 61/61 ?,
15006,15,2013-09-23,různé,4,Kdo souhlasí s uzavřením dohody o právním zastoupení ve věci žaloby na část územního plánu,
15007,15,2013-09-23,různé,4,Kdo souhlasí s uzavřením partnerských smluv - PARTNERSKÉ SMLOUVY NA AKCE ZAŘAZENÍ V ČÁSTI „A' PROGRAMU VÝSTAVBY,
15008,15,2013-09-23,různé,4,Kdo souhlasí s uzavřením partnerských smluv na akci Rekonstrukce MŠ?,
15009,15,2013-09-23,různé,4,Kdo souhlasí s uzavřením smlouvy na výkon techn. dozoru na akci Izolační zeleň Toskánka,
15010,15,2013-09-23,různé,4,Kdo souhlasí předběžně s uzavřením smlouvy na výsadbu zeleně podél chodníku Braškov-Kyšice za cenu do 200 tis. Kč?,
15011,15,2013-09-23,usnesení a závěr,6,Kdo souhlasí s navrženým usnesením,
16001,16,2013-12-16,program,1,hlasování o programu,
16002,16,2013-12-16,KONTROLA PLNĚNÍ USNESENÍ 13. A 14. ZASEDÁNÍ,2,"Kdo souhlasí, abychom vzali informaci o kontrole plnění usnesení 13. a 14. zasedání na vědomí",
16003,16,2013-12-16,ZPRÁVA O FINANČNÍM HOSPODAŘENÍ OBCE K 30.11.2013,3,"Kdo souhlasí, abychom vzali zprávu o finančním hospodaření obce k 30.11.2013 na vědomí",
16004,16,2013-12-16,VÝSLEDEK DÍLČÍ KONTROLY HOSPODAŘENÍ OBCE ZA ROK 2013,4,"Kdo souhlasí, abychom vzali zprávu o dílčí kontrole hospodaření obce na vědomí?",
16005,16,2013-12-16,AKTUALIZACE PROGRAMU VÝSTAVBY,5,Kdo souhlasí a aktualizovaným Programem výstavby obce,
16006,16,2013-12-16,NÁVRH 5. ZMĚNY ROZPOČTU OBCE PRO R. 2013,6,Kdo je pro schválení 5. změny rozpočtu na r. 2013?,
16007,16,2013-12-16,NÁVRH ROZPOČTU OBCE PRO R. 2014,7,Kdo souhlasí s předloženým návrhem rozpočtu na r. 2014,
16008,16,2013-12-16,SCHVÁLENÍ VÝSLEDKŮ VÝBĚROVÝCH ŘÍZENÍ,8,Kdo je pro schválení výsledků výběrových řízení?,
16009,16,2013-12-16,různé,9,Kdo souhlasí se stanoviskem starostů - ŽÁDOST O POMOC HEJTMANA STŘEDOČESKÉHO KRAJE VE VĚCI SPALOVNY V. DOBRÁ,
16010,16,2013-12-16,různé,9,Kdo souhlasí s uzavřením dodatku č. 1 ke smlouvě o dílo ulice Budovatelů,
16011,16,2013-12-16,různé,9,kdo souhlasí s uzavřením uvedené smlouvy o právním zastoupení s JUDr. Svobodovou,
16012,16,2013-12-16,různé,9,Kdo souhlasí s podáním žádostí o dotace ze SFŽP. STČ. KRAJE A SFDI ČR,
16013,16,2013-12-16,různé,9,Kdo souhlasí s uvedenými návrhy smluv -SMLOUVY O POSKYTNUTÍ DOTACE PRO T.Ť SOKOL BRAŠKOV NA ROK 2014,
16014,16,2013-12-16,různé,9,Kdo souhlasí s uzavřením uvedených smluv? - SMLOUVY O BUDOUCÍ SMLOUVĚ KUPNÍ. O VÝPŮJČCE. SMĚNĚ A O ZŘÍZENÍ VĚCNÉHO BŘEMENE,
16015,16,2013-12-16,různé,9,Kdo souhlasí s uzavřením partnerských smluv? - SMLOUVY O PARTNERSTVÍ S OBCEMI KYŠICE. PLETENÝ ÚJEZD A MĚSTEM UNHOŠŤ NA NOVÉ VÝSADBY ZELENĚ A OBNOVU POLNÍ CESTY,
16016,16,2013-12-16,různé,9,kdo souhlasí s uzavřením uvedených smluv- SMLOUVY O PARTNERSTVÍ S OBCEMI KYŠICE A PLETENÝ ÚJEZD K PROJEKTU STAVEBNÍ ÚPRAVY A ROZŠÍŘENÍ KAPACITY MŠ BRAŠKOV,
16017,16,2013-12-16,různé,9,Kdo souhlasí se zaměřením a zpracováním GP od Geodetické kanceláře Bílek a Vydra,
16018,16,2013-12-16,různé,9,Kdo souhlasí s uzavřením předloženého návrhu kupní smlouvy na pozemek č. 61/17? ,
16019,16,2013-12-16,usnesení a závěr,11,Kdo souhlasí s navrženým usnesením,
17001,17,2014-01-20,program,1,hlasování o programu,
17002,17,2014-01-20,SCHVÁLENÍ SMLOUVY S REGIONÁLNI RADOU REGIONU SOUDRŽNOSTI STŘEDNÍ ČECHY O POSKYTNUTÍ DOTACE A ODPOVÍDAJÍCÍ SPOUFINANCOVÁNÍ PROJEKTU ..VÍTEJTE V BRÁŠKOVĚ - podpora a rozvoj cestovního ruchu v obci Braškov' reg. č.: CZ.1.15/2.2.00/72.01651,2,Kdo souhlasí s uzavřením této smlouvy o poskytnutí dotace a spolufinancováním projektu,
17003,17,2014-01-20,VÝSLEDEK HOSPODAŘENÍ OBCE K 31.12.2013,3,"Kdo souhlasí, abychom vzali výsledek hospodaření obce k 31.12.2013 na vědomí",
17004,17,2014-01-20,ÚČETNÍ ODPISOVÝ PLÁN OBCE NA ROK 2014,4,Kdo souhlasí s odpisovým plánem obce na rok 2014,
17005,17,2014-01-20,různé,5,Kdo souhlasí s uzavřením smlouvy s ing. Polákem,
17006,17,2014-01-20,různé,5,Kdo souhlasí s vyřazením starého neplatného územního plánu z majetku obce?,
17007,17,2014-01-20,různé,5,Kdo souhlasí s uzavřením smluv o partnerství k projektu ..STAVEBNÍ ÚPRAVY A ROZŠÍŘENÍ KAPACITY MŠ BRAŠKO?,
17008,17,2014-01-20,různé,5,Kdo souhlasí s cenovou nabídkou p. Prynycha ve výši 41 tis. Kč na změnu PD „Výtvarná dílna pro děti a mládež?,
17009,17,2014-01-20,různé,5,Kdo souhlasí s podáním stížnosti na Katastrální úřad pro Středočeský kraj,
17010,17,2014-01-20,různé,5,Kdo souhlasí s dodavatelem na údržbu zeleně paní Pavlínou Novotnou ze Slaného,
17011,17,2014-01-20,usnesení a závěr,7,Kdo souhlasí s navrženým usnesením,
18001,18,2014-03-31,program,1,hlasování o programu,
18002,18,2014-03-31,KONTROLA PLNĚNÍ USNESENÍ 15. A 16. ZASEDÁNÍ,2,"Kdo souhlasí, abychom vzali informaci o kontrole plnění usnesení 15. a 16. zasedání na vědomí",
18003,18,2014-03-31,ÚČETNÍ ZÁVĚRKA VČ. VÝSLEDKU HOSPODAŘENÍ ZA ROK 2013 A ZÁVĚREČNÝ ÚČET ROKU 2013,3,Kdo souhlasí s účetní závěrkou vč. výsledku hospodaření za rok 2013 a závěrečným účtem obce Braškov za rok 2013 včetně zprávy o výsledku přezkoumání hospodaření obce bez výhrady?,
18004,18,2014-03-31,ZMĚNA ROZPOČTU NA ROK 2014,4,Kdo souhlasí se schválením změny rozpočtu na rok 2014?,
18005,18,2014-03-31,ZPRÁVA O HOSPODAŘENÍ OBCE K 28.2.2014,5,"Kdo souhlasí, abychom vzali zprávu o hospodaření obce k 28.2.2014 na vědomí?",
18006,18,2014-03-31,PROGRAM VÝSTAVBY,6,Kdo souhlasí se schválením předložené aktualizace Programu výstavby?,
18007,18,2014-03-31,HŘBITOV MALÉ PŘÍTOČNO,7,Kdo souhlasí s předloženým návrhem rozpočtu na r. 2014?,
18008,18,2014-03-31,SOUHLAS S PODÁNÍM ŽÁDOSTÍ O DOTACE NA AKCE Z ROP A SFŽP,8,Kdo souhlasí se schválením uvedených žádostí o dotace,
18009,18,2014-03-31,EVROPSKÉ VOLBY,9,"Kdo souhlasí, abychom vzali informaci na vědomí",
18010,18,2014-03-31,různé,10,Kdo souhlasí se stanoviskem obce ke Strategii udržitelného rozvoje?,
18011,18,2014-03-31,různé,10,Kdo souhlasí s uzavřením předložené smlouvy a přijetím nabídky - NABÍDKA NA ZPRACOVÁNÍ DOKUMENTACE NA BRAŠKOVSKÝ POTOK. RYBNÍK A STUDÁNKU,
18012,18,2014-03-31,různé,10,"Kdo souhlasí, abychom zajistili zabezpečení objektu podle cenových nabídke p. Jenčíka a firmy Univers",
18013,18,2014-03-31,různé,10,Kdo souhlasí s uzavřením smlouvy s ing. Wiesnerem a s firmou WITERO na uvedené tituly?,
18014,18,2014-03-31,různé,10,Kdo souhlasí s předloženou nabídkou paní Novotné na Obnovu rostlinných struktur,
18015,18,2014-03-31,různé,10,"Kdo souhlasí s tím, abychom v případě dohody odkoupili 3500 m2 za navržených 100.— Kč?",
18016,18,2014-03-31,různé,10,kdo souhlasí s uzavřením dodatku č. 2 smlouvy s firmou Konprax,
18017,18,2014-03-31,různé,10,"Kdo souhlasí s tím, abychom uzavřeli smlouvy o dílo s ing. Křižákem na silnici U Dubu a Akátová?",
18018,18,2014-03-31,různé,10,Kdo souhlasí s odkupem veřejného prostranství před Jednotou za 100.— Kč/m2?,
18019,18,2014-03-31,usnesení a závěr,11,Kdo souhlasí s navrženým usnesením?,
19001,19,2014-05-05,SCHVÁLENÍ VÝSLEDKU VÝBĚROVÉHO ŘÍZENÍ NA AKCI „VÍTEJTE V BRÁŠKOVĚ - PODPORA A ROZVOJ CESTOVNÍHO RUCHU V OBCI BRAŠKOV A SOUHLAS S UZAVŘENÍM SMLOUVY S VYBRANÝM ZHOTOVITELEM,2,"Kdo souhlasí, s výsledkem výběrového řízení na zhotovitele a s uzavřením smlouvy ?",
19002,19,2014-05-05,SOUHLAS S AKTUALIZOVANÝM ZÁMĚREM NA SMĚNU POZEMKŮ P.Č.. 245/1. 245/4. 245/14 a 245/18 ZA POZEMEK P.Č. 324 BEZ NÁROKU OBCE NA FINANČNÍ VYROVNÁNÍ OD S.P. LESY ČR,3,Kdo souhlasí s uzavřením směnné smlouvy bez nároku obce na finanční vyrovnání od s.p. LESY ČR?,
19003,19,2014-05-05,usnesení a závěr,4,Kdo souhlasí s navrženým usnesením?,
20001,20,2014-06-30,program,1,hlasování o programu,
20002,20,2014-06-30,KONTROLA PLNĚNÍ USNESENÍ 17. A 18. ZASEDÁNÍ,2,"Kdo souhlasí, abychom vzali informaci o kontrole plnění usnesení 17. a 18. zasedání na vědomí?",
20003,20,2014-06-30,ZPRÁVA O HOSPODAŘENÍ OBCE K 31.5.2014,3,"Kdo souhlasí, abychom vzali zprávu o hospodaření obce k 31.5.2014 na vědomí",
20004,20,2014-06-30,ZMĚNA ROZPOČTU OBCE Č. 3,4,Kdo souhlasí se schválením změny rozpočtu obce č. 3,
20005,20,2014-06-30,PROGRAM VÝSTAVBY,5,Kdo souhlasí se schválením předložené aktualizace Programu výstavby,
20006,20,2014-06-30,STANOVENÍ POČTU ČLENŮ ZASTUPITELSTAVA PRO OBDOBÍ 2014-2018,6,"Kdo souhlasí, aby zastupitelstvo obce pro příští volební období mělo 15 členů?",
20007,20,2014-06-30,různé,7,Kdo souhlasí s výběrem zhotovitele na akci „Chodník - Toskánka' firmou SILNICE TS s.r.o. Voznice?,
20008,20,2014-06-30,různé,7,"Kdo souhlasí s výběrem projektanta Projekce dopravní Filip s.r.o. Roudnice nad Labem na akci „Komunikace pro pěší Braškov, Valdek - Velká Dobrá",
20009,20,2014-06-30,různé,7,Kdo souhlasí s výběrem ing. Tomáše Hlavatého na administraci projektů „Nové výsadby izolační zeleně v Bráškově a obnova cesty z Bráškova do Kyšic' a „Úprava veřejných prostranství v obci Braškov - projekt nových výsadeb veřejné zeleně,
20010,20,2014-06-30,různé,7,Kdo nesouhlasí s přijetím nabídky ing. Čermákové na odkup pozemků?,
20011,20,2014-06-30,různé,7,"Kdo souhlasí s poskytnutím příspěvku na nadační festival Valdecký háj ve výši 50.000,- Kč",
20012,20,2014-06-30,různé,7,"Kdo souhlasí s s uzavřením smlouvy o dotaci s Regionální radou regionu soudržnosti Střední Čechy o poskytnutí dotace ve výši 6.214.676,36 Kč a schvaluje vyčlenění peněžní částky ve výši 1.559.379,10 Kč na spolufinancování projektu",
20013,20,2014-06-30,různé,7,"Kdo souhlasí s s prodejem části pozemku č. 258/17 o výměře cca 12 m2 firmě ČEZ po oddělení pod trafostanicí za 250,- Kč/m2?",
20014,20,2014-06-30,různé,7,"Kdo souhlasí s odkoupením prodejny na Bráškově od JEDNOTY do 3,5 mil. Kč?",
20015,20,2014-06-30,různé,7,Kdo souhlasí s výběrem zhotovitele firmou TAROS TSK s.r.o. na akci „Galerie pod širým nebem'?,
20016,20,2014-06-30,různé,7,"Kdo souhlasí s výběrem firmy M-FINANCE s.r.o., a uzavřením dílčí mandátní smlouvy na výběrové řízení na zhotovitele na akci „Výtvarná dílna pro děti a dospělé?",
20017,20,2014-06-30,různé,7,"Kdo souhlasí s uzavřením dílčí mandátní smlouvy s firmou M-Finance s.r.o. , na provedení výběrového řízení na zhotovitele akce „Stavební úpravy a rozšíření kapacity MŠ Braškov'?",
20018,20,2014-06-30,různé,7,Kdo souhlasí s výběrem administrátora ing. Markétou Landovou Ph.D. na akci „Stavební úpravy a rozšíření kapacity MŠ Braškov?,
20019,20,2014-06-30,různé,7,Kdo souhlasí se směnou pozemků na chodník Valdek - Velká Dobrá s manželi Brejníkovými,
20020,20,2014-06-30,různé,7,Kdo souhlasí s případným navýšením finanční spoluúčasti obce na financování akce „Výtvarná dílna pro děti a dospělé'?,
20021,20,2014-06-30,různé,7,"Kdo souhlasí s tím, aby obec jednala o překlenovacím úvěru s bankami do úvěrového rámce 20 mil. Kč?",
20022,20,2014-06-30,různé,7,Kdo souhlasí se zpracováním dokumentace na rekonstrukci hřbitova v M . Přítočně?,
20023,20,2014-06-30,usnesení a závěr,9,Kdo souhlasí s navrženým usnesením?,
21001,21,2014-07-28,program,1,hlasování o programu,
21002,21,2014-07-28,KONTROLA PLNĚNÍ USNESENÍ 19. ZASEDÁNÍ,2,"Kdo souhlasí, abychom vzali informaci o kontrole plnění usnesení 19. zasedání na vědomí?",
21003,21,2014-07-28,ZPRÁVA Q HOSPODAŘENÍ OBCE K 30.6.2014,3,"Kdo souhlasí, abychom vzali zprávu o hospodaření obce k 30.6.2014 na vědomí?",
21004,21,2014-07-28,ODKUP STÁVAJÍCÍ PRODEJNY S.D. JEDNOTA,4,Kdo souhlasí s odkupem stávající prodejny Jednoty a uzavřením kupní smlouvy?,
21005,21,2014-07-28,ZMĚNA ÚZEMNĚ PLÁNOVACÍ DOKUMENTACE -STABILIZACE ROZSAHU ASTAVĚNÉ ČÁSTI ÚZEMÍ A POSÍLENÍ ENVIROMENTÁLNÍCH FUNKCÍ KRAJINY V CELÉM KATASTRÁLNÍM ÚZEMÍ BRAŠKOV,5,Kdo souhlasí s podáním žádosti o podporu projektu aplikace enviromentální výchovy vzdělávání a osvěty při prosazování enviromentálních funkcí krajiny a stabilizaci rozsahu zastavěné části území v rámci přípravy projednání a realizace změny územně plánovací dokumentace č. 1 v obci Braškov,
21006,21,2014-07-28,VÝSLEDEK POPTÁVKOVÉHO ŘÍZENÍ NA POSKYTNUTÍ ÚVĚRU NA KOFINANCOVÁNÍ AKCÍ. ZAŘAZENÝCH V PROGRAMU VÝSTAVBY,6,Kdo souhlasí s výsledkem poptávkového řízení na poskytnutí úvěru a uzavřením smlouvy o úvěru na kofinancování akcí s Českou spořitelnou a.s.?,
21007,21,2014-07-28,různé,7,"Kdo souhlasí s tím, abychom informaci o stanovisku odboru dopravy MMk k našemu požadavku na omezení těžké nákl. dopravy vzali na vědomí",
21008,21,2014-07-28,různé,7,Kdo souhlasí s cenovou nabídkou V K M na vyčištění uličních vpustí,
21009,21,2014-07-28,různé,7,Kdo souhlasí se záměrem vybudovat v obci varovný systém pomocí rozvodu optovodičů?,
21010,21,2014-07-28,různé,7,Kdo souhlasí s uzavřením směnné smlouvy s MUDr. Brejníkem,
21011,21,2014-07-28,usnesení a závěr,9,Kdo souhlasí s navrženým usnesením?,
22001,22,2014-09-29,program,1,hlasování o programu,
22002,22,2014-09-29,KONTROLA PLNĚNÍ USNESENÍ 20. ZASEDÁNÍ,2,"Kdo souhlasí, abychom vzali informaci o kontrole plnění usnesení 20. zasedání na vědomí?'",
22003,22,2014-09-29,ZPRÁVA O HOSPODAŘENÍ OBCE K 31.8.2014,3,"Kdo souhlasí, abychom vzali zprávu o hospodaření obce k 30.6.2014 na vědomí",
22004,22,2014-09-29,INFORMACE O PROGRAMU VÝSTAVBY A JEHO PLNĚNÍ V UPLYNULÉM VOLEBNÍM OBDOBÍ,4,Kdo souhlasí s tímto programem výstavby?,
22005,22,2014-09-29,SMĚNY A ODKOUPENÍ POZEMKŮ,5,"Kdo souhlasí s návrhem kupní smlouvy na prodej pozemku pare, st. č. 506?",
22006,22,2014-09-29,různé,7,Kdo souhlasí se zakoupením dvou trezorů,
22007,22,2014-09-29,různé,7,"Kdo souhlasí s přijetím dotací z rozpočtu Středočeského kraje a uzavřením smluv o poskytnutí dotace na akci Výtvarná dílna pro děti a dospělé ve výši 1.000.000,— Kč a na akci Revitalizace lesoparku Háj ve výši 1.573.093,— Kč",
22008,22,2014-09-29,různé,7,"Kdo souhlasí s výběrem zhotovitele společností ECQDIS za 738.100,— Kč vč. DPH na projekt „Aplikace EVVQ při prosazování environmentálních funkcí krajiny a stabilizace rozsahu zastavěné části území v rámci přípravy, projednání a realizace změny č.l Územně plánovací dokumentace obce Braškov'?",
22009,22,2014-09-29,různé,7,"Kdo souhlasí s výběrem zhotovitele na akci „Stavební úpravy a rozšíření kapacity MŠ' firmou HORACOMPRANY s.r.o. za 7.631.004,42 Kč vč. DPH",
22010,22,2014-09-29,různé,7,"Kdo souhlasí s výběrem zhotovitele na akci „Výtvarná dílna pro děti a dospělé' firmou KOSTAV s.r.0. za 2.715.716,- Kč bez DPH",
22011,22,2014-09-29,různé,7,"Kdo souhlasí s výběrem techn. dozoru investora ing. Janem Rysem na stavby „Stavební úpravy a rozšíření kapacity MŠ Braškov', „Braškov - lokalita Toskánka - komunikace pro pěší' a „Výtvarná dílna pro děti a dospělé' rozšíření kapacity MŠ'",
22012,22,2014-09-29,různé,7,"Kdo souhlasí s úhradou částky 855.520,— Kč bez DPH za vícepráce na akci „Vítejte v Braškověpodpora a rozvoj cestovního ruchu v obci Braškov'?",
22013,22,2014-09-29,různé,7,"Kdo souhlasí s souhlasí s úhradou částky 949.806,- Kč bez DPH za vícepráce za zhotovení vjezdů a s úhradou částky 105.000,- Kč bez DPH za osvětlení na akci „Braškov - lokalita Toskánka - Komunikace pro pěší'?",
22014,22,2014-09-29,různé,7,Kdo souhlasí s výběrem ing. Hlavatého jako administrátora na akci „Snížení prašnosti v obci Braškov' za 48 tis. Kč?,
22015,22,2014-09-29,usnesení a závěr,9,Kdo souhlasí s navrženým usnesením?,
23001,23,2014-10-06,program,1,hlasování o programu,
23002,23,2014-10-06,program,1,Kdo souhlasí se složením návrhové komise?,
23003,23,2014-10-06,ODSOUHLASENÍ ZMĚNY ZHOTOVITELE AKCE „STAVEBNÍ ÚPRAVY A ROZŠÍŘENÍ KAPACITY MŠ BRAŠKOV,2,"Kdo souhlasí s výběrem zhotovitele akce „Stavební úpravy a rozšíření kapacity MŠ Braškov' spol. s r.o. KOSTAV, Malé Kyšice za cenu 7.839.720,91 vč. DPH a dokončením akce do 15.5.2014?",
23004,23,2014-10-06,usnesení a závěr,4,Kdo souhlasí s navrženým usnesením?,
