id,legislative_session:number,start_date,item:title,item:number,motion:title,
1001,1,2010-11-15,program,3,hlasování o programu,
1002,1,2010-11-15,VOLBA STAROSTY,4,"Zastupitelé zvolení na kandidátce ODS a nezávislí navrhují, aby starostou obce byl zvolen ing. Vladimír Dráb",
1003,1,2010-11-15,VOLBA MÍSTOSTAROSTY A ČLENŮ RADY OBCE,5,"Starosta do návrhové komise navrhl zvolit předsedu p. Haase, členy: p. Bečka a pí. Pilátová.",
1004,1,2010-11-15,VOLBA MÍSTOSTAROSTY A ČLENŮ RADY OBCE,5,"Na funkci místostarosty obce navrhl, aby byl zvolen pan František Haas",
1005,1,2010-11-15,VOLBA MÍSTOSTAROSTY A ČLENŮ RADY OBCE,5,"Dráb navrhl, aby členy rady byli zvoleni: ing. Doksanský, p. Votava a pí. Cábová.",
1006,1,2010-11-15,ZŘÍZENÍ KONTROLNÍHO A FINANČNÍHO VÝBORU,6,"Dráb navrhl, aby předsedkyní kontrolního výboru byla zvolena pí. Miloslava Vostrá",
1007,1,2010-11-15,ZŘÍZENÍ KONTROLNÍHO A FINANČNÍHO VÝBORU,6,"Dráb navrhl, aby předsedkyní kontrolního výboru byla zvolena pí. Miloslava VostráZa členy kontrolního výboru starosta navrhl paní Marii Cábovou a pana Jiřího Sochnu. ",
1008,1,2010-11-15,ZŘÍZENÍ KONTROLNÍHO A FINANČNÍHO VÝBORU,6,Do funkce předsedy finančního výboru navrhl ing. Dráb paní ing. Moniku Randákovou,
1009,1,2010-11-15,ZŘÍZENÍ KONTROLNÍHO A FINANČNÍHO VÝBORU,6,"Za členy finančního výboru starosta navrhl pana Josefa Havlíka, paní Naděždu Cernošovou a paní Štěpánku Pilátovou",
1010,1,2010-11-15,SCHVÁLENÍ JEDNACÍHO ŘÁDU ZASTUPITELSTVA,7,"Kdo souhlasí, s návrhem jednacího řádu",
1011,1,2010-11-15,různé,8,"starosta navrhl, aby odměny neuvolněným členům zastupitelstva byly oproti výši podle vládního nařízení sníženy o 15%",
1012,1,2010-11-15,různé,8,"Kdo souhlasí, s odkoupení bývalé prodejny Valdek za cenu do 3.200 tis. Kč?",
1013,1,2010-11-15,různé,8,"Starosta uvedl, že ve Velké Dobré má vzniknout experimentální spalovna plastových součástí z vozidel a pneumatik. Na internetu a obci je volně k dispozici dokumentace EIA- popsání vlivu na životní prostředí. Uvádí se max. zvýšení úmrtnosti obyvatel naší obce 3%. Předpokládáme negativní vliv na naší obec. Je vydáno stavební povolení, které obec napadne, neboť není vydáno v souladu se zákonem, starosta konzultoval s primátorem Kladna Jiránkem. Návrh stanoviska obce zastupitelé obdrželi. Kdo souhlasí s tím, abychom k uvedenému záměru vyslovili zásadní nesouhlas",
1014,1,2010-11-15,různé,8,Kdo souhlasí se zrušením územně plánovací smlouvy schválené na 19. zasedání ZQ,
1015,1,2010-11-15,různé,8,Kdo souhlasí se schválením nové územně plánovací smlouvy,
1016,1,2010-11-15,různé,8,"Navrhl určit do funkce zastupitele, ktetý bude spolupracovat s pořizovatelem ÚP, p. F. Haase.",
1017,1,2010-11-15,různé,8,Kdo souhlasí s pořízením auta pro mladé hasiče,
1018,1,2010-11-15,různé,8,Schválení výběrového řízení na výkon stavebního dozoru na akci „Dětské hřiště a in-line dráha na Háj,
1019,1,2010-11-15,různé,8,Souhlas se žádostí o dotace z FRQM a ROP,
1020,1,2010-11-15,různé,8,"souhlas se Smlouvou na zpracování SEA k územnímu plánu, která bude uzavřena s ing. Horákovou",
1021,1,2010-11-15,usnesení a závěr,10,Kdo souhlasí s navrženým usnesením,
2001,2,2010-12-13,program,1,hlasování o programu,
2002,2,2010-12-13,ZMENA ROZPOČTU OBCE PRO R. 2010,3,"Kdo souhlasí, s návrhem 3. změny rozpočtu na rok 2010?",
2003,2,2010-12-13,ROZPOČET OBCE NA ROK 2011,4,Kdo souhlasí s návrhem rozpočtu obce na rok 2011,
2004,2,2010-12-13,různé,7,Kdo souhlasí s uzavřením smlouvy S ING. ČERVENÝM NA ZPRACOVÁNÍ STUDIE NA REKONSTRUKCI PRODEJNY VALDEK,
2005,2,2010-12-13,různé,7,Kdo souhlasí s návrhem na složení inventarizačních komisí?,
2006,2,2010-12-13,různé,7,Kdo souhlasí s návrhem ing. Dolejšové na pojištění prodejny,
2007,2,2010-12-13,různé,7,Kdo souhlasí s uzavřením smlouvy o pronájmu prodejny Valdek,
2008,2,2010-12-13,různé,7,Kdo souhlasí s vypsáním výběrového řízení NA PRACOVNICI OBECNÍHO ÚŘADU,
2009,2,2010-12-13,usnesení a závěr,9,Kdo souhlasí s navrženým usnesením,
3001,3,2011-04-04,program,1,hlasování o programu,
3002,3,2011-04-04,VÝSLEDEK HOSPODAŘENÍ OBCE K 31.12.2010,3,"Ředitelka MŠ žádá o převedení hospodářského výsledku za rok 2010 ve výši 10.634,56 Kč do rezervního fondu školy",
3003,3,2011-04-04,NÁVRH 1. ZMĚNY ROZPOČTU OBCE NA ROK 2011,4,"Kdo souhlasí, s návrhem 1. změny rozpočtu na rok 2011",
3004,3,2011-04-04,ROZPOČTOVÝ VÝHLED DO R. 2014,5,Kdo souhlasí s rozpočtovým výhledem do r. 2014,
3005,3,2011-04-04,PROGRAM VÝSTAVBY OBCE. STAV PRŮBĚHU JEHO PLNĚNÍ A PODÁNÍ ŽÁDOSTÍ O DOTACE,6,"Kdo souhlasí, s návrhem programu výstavby obce",
3006,3,2011-04-04,různé,7,"Kdo souhlasí, s návrhem na uzavření smlouvy o zřízení věc, břemene s CEZ v ul. V Jezerech?",
3007,3,2011-04-04,různé,7,"Kdo souhlasí, s návrhem na uzavření smlouvy o zřízení věc, břemene s RWE v ul. Zahradní?",
3008,3,2011-04-04,různé,7,"Kdo souhlasí, s výsledky výběr, řízení a financováním PD na jednotlivé stavební akce",
3009,3,2011-04-04,různé,7,"Kdo souhlasí, s nabídkou na odkup pozemků od Aelia Property s.r.o.?",
3010,3,2011-04-04,různé,7,Kdo souhlasí s uzavřením veřejno správní smlouvy s obcí V. Dobrá?,
3011,3,2011-04-04,různé,7,Kdo souhlasí s návrhem nájemní smlouvy ordinace v budově obecního úřadu,
3012,3,2011-04-04,různé,7,Kdo souhlasí s odkupem pozemku p.č. 125?,
3013,3,2011-04-04,různé,7,Kdo souhlasí s úpravou autobusové čekárny na valdeku ?,
3014,3,2011-04-04,různé,7,Kdo souhlasí s rozdělením parcely p. č. 258/79?,
3015,3,2011-04-04,usnesení a závěr,9,Kdo souhlasí s navrženým usnesením,
4001,4,2011-06-20,program,1,hlasování o programu,
4002,4,2011-06-20,ZÁVĚREČNÝ ÚČET OBCE ZA R. 2010 A VÝSLEDEK AUDITU,3,Kdo souhlasí se schválením závěrečného účtu vč. zprávy o výsledku přezkoumání hospodaření obce s touto výhradou ?,
4003,4,2011-06-20,různé,6,"Kdo souhlasí, s návrhem na odvolání ing. Máchovské z komise životního prostředí",
4004,4,2011-06-20,různé,6,Kdo souhlasí se uzavřením smlouvy na celoroční údržbu keřového a stromového patra v Obci Braškov.,
4005,4,2011-06-20,různé,6,"Kdo souhlasí, abychom zprávu o výsledku kontroly finančního úřadu a její závěry vzali na vědomí?",
4006,4,2011-06-20,různé,6,Kdo souhlasí s realizací doplnění zeleně a s uzavřením smlouvy,
4007,4,2011-06-20,různé,6,Kdo souhlasí s realizací instalace elektrické přípojky a s uzavřením smlouvy,
4008,4,2011-06-20,různé,6,Kdo souhlasí s rekonstrukcí komunikace toskánka,
4009,4,2011-06-20,různé,6,Kdo souhlasí s uvedeným návrhem dodatku smlouvy rekonstrukce ulice krátké,
4010,4,2011-06-20,různé,6,Kdo souhlasí s realizací návrhu na rozšíření ordinace v objektu obecního úřadu,
4011,4,2011-06-20,různé,6,Kdo souhlasí s využitím nabídky pozemkového fondu?,
4012,4,2011-06-20,různé,6,Kdo souhlasí s odkupem uvedených částí pozemků nebo zřízením věcného břemena a opravy cesty na poz. 258/84?,
4013,4,2011-06-20,usnesení a závěr,9,Kdo souhlasí s navrženým usnesením,
5001,5,2011-09-26,program,1,hlasování o programu,
5002,5,2011-09-26,2. A 3.ZMĚNA ROZPOČTU NA ROK 2011,4,Hlasování o 2. a 3. změně rozpočtu obce na r. 2011,
5003,5,2011-09-26,2. A 3.ZMĚNA ROZPOČTU NA ROK 2011,4,Kdo souhlasí s uzavřením krátkodobého překlenovacího úvěru podle návrhu finančního výboru,
5004,5,2011-09-26,SOUHLAS S PŘIJETÍM DOTACI,6,Kdo souhlasí s přijetím uvedených dotací,
5005,5,2011-09-26,SOUHLAS SE ZPRACOVÁNÍM DOKUMENTACÍ A PODÁNÍM ŽÁDOSTÍ O DOTACE,7,Kdo souhlasí s uvedeným návrhem,
5006,5,2011-09-26,různé,8,uzavření SMLOUVy NA PROJEKT AKCE ..REKONSTRUKCE OÚ A ZŘÍZENÍ ORDINACE,
5007,5,2011-09-26,různé,8,Kdo souhlasí s uzavřením smluv s vybranými zhotoviteli na akci REVITALIZACE OBECNÍHO CENTRA VALDEK' A ..SBĚRNÉ MÍSTO,
5008,5,2011-09-26,různé,8,Kdo souhlasí s uvedenými návrhy na směny pozemků?,
5009,5,2011-09-26,různé,8,Kdo souhlasí s uvedenými návrhy na odkup pozemků?,
5010,5,2011-09-26,různé,8,Kdo souhlasí se ZŘÍZENÍm NOVÉHO SVĚTLA VEŘEJNÉHO OSVĚTLENÍ,
5011,5,2011-09-26,různé,8,Kdo souhlasí s předloženými návrhy vyhlášek č. 1/2011 a č. 2/2011,
5012,5,2011-09-26,různé,8,"Kdo souhlasí s tím, abychom na uvedeném návrhu o dopravním značení na silnici II/118 trvali a proti rozhodnutí odboru dopravy podali stížnost",
5013,5,2011-09-26,různé,8,Kdo souhlasí s doplněním komise životního prostředí,
5014,5,2011-09-26,různé,8,Kdo souhlasí s uzavřením smlouvy podle cenové nabídky na opravu komunikace u Dubu,
5015,5,2011-09-26,různé,8,Kdo souhlasí s uzavařením smlouvy podle této nabídky-NABÍDKA NA VÝKON STAV. DOZORU PŘI AKCI ..Revitalizace obecního centra Valdek',
5016,5,2011-09-26,usnesení a závěr,10,Kdo souhlasí s navrženým usnesením,
6001,6,2011-10-26,program,1,hlasování o programu,
6002,6,2011-10-26,REKONSTRUKCE A PŘÍSTAVBA OÚ BRAŠKOV,2,Kdo souhlasí s uzavřením smlouvy s vybraným zhotovitelem ing. arch. Albrechtem,
6003,6,2011-10-26,REKONSTRUKCE A PŘÍSTAVBA OÚ BRAŠKOV,2,Kdo souhlasí s uzavřením smlouvy s vybraným zhotovitelem Valdeker s.r.o.?,
6004,6,2011-10-26,REKONSTRUKCE A PŘÍSTAVBA OÚ BRAŠKOV,2,Kdo souhlasí s realizací rozšířeného záměru?,
6005,6,2011-10-26,REKONSTRUKCE A PŘÍSTAVBA OÚ BRAŠKOV,2,Kdo souhlasí s uzavřením nájemní smlouvy na ordinaci s MUDr. Konečnou?,
6006,6,2011-10-26,SMLOUVA O PŘEKLENOVACÍM ÚVĚRU K 31.8.2011,3,Kdo souhlasí s uzavřením smlouvy o překlenovacím úvěru?,
6007,6,2011-10-26,VÝBĚROVÉ ŘÍZENÍ NA ZPRACOVATELE PROJEKTŮ,4,Kdo souhlasí s uzavřením smlouvy s vybraným projektantem ing. Křižákem,
6008,6,2011-10-26,VÝBĚROVÉ ŘÍZENÍ NA ZPRACOVATELE PROJEKTŮ,4,Kdo souhlasí s uzavřením smlouvy s vybraným projektantem ing. Křižákem,
6009,6,2011-10-26,různé,5,Kdo souhlasí s mimořádným auditem na výběrová řízení krajským úřadem?,
6010,6,2011-10-26,různé,5,Kdo souhlasí s uzavřením smlouvy se zhotovitelem podle předložené nabídky?,
6011,6,2011-10-26,různé,5,Kdo souhlasí se záměrem na prodej uvedených pozemků v k.ú. Doksy u Kladna?,
6012,6,2011-10-26,různé,5,Kdo souhlasí s uzavřením smlouvy o zřízení věcného břemene?,
6013,6,2011-10-26,diskuze,6,Kdo souhlasí s pověřením ing. Randákové kontrolou čerpání prostředků z rozpočtu obce?,
6014,6,2011-10-26,usnesení a závěr,7,Kdo souhlasí s navrženým usnesením,
7001,7,2011-12-19,program,1,hlasování o programu,
7002,7,2011-12-19,4. ZMĚNA ROZPOČTU NA ROK 2011,5,Kdo souhlasí se 4. změnou rozpočtu obce na r. 2011?,
7003,7,2011-12-19,NÁVRH ROZPOČTU OBCE NA R. 2012,6,Kdo souhlasí s rozpočtem obce na r. 2012?,
7004,7,2011-12-19,INFORMACE O VÝSLEDKU DÍLČÍ KONTROLY HOSPODAŘENÍ OBCE,7,"Kdo souhlasí, aby byly závěry uvedeného zápisu vzaty na vědomí",
7005,7,2011-12-19,ZPRÁVA O PRŮBĚHU AKCÍ ..PROGRAMU VÝSTAVBY',8,"Kdo souhlasí, aby byla uvedená zpráva vzata na vědomí?",
7006,7,2011-12-19,různé,9,"Kdo souhlasí, aby předsedkyní kontrolního výboru byla zvolena paní S. Pilátová?",
7007,7,2011-12-19,různé,9,"Kdo souhlasí, aby členem finančního výboru byl zvolen p. B. Bečka",
7008,7,2011-12-19,různé,9,Kdo souhlasí s uzavřením uvedené smlouvy o výpůjčce a úhradou provozních vícenákladů v celkové vvši 50.000.- Kč?,
7009,7,2011-12-19,různé,9,Kdo souhlasí s přílohou č. 1 k vyhlášce č. 1 k vyhlášce č. 4/2005 o stanovení místního poplatku za odstraňování komunálního odpadu,
7010,7,2011-12-19,různé,9,Kdo souhlasí s odkupem pozemků č. 78/38. 280 a 400 podle přiložené smlouvy za cenu 154.340.— Kč?,
7011,7,2011-12-19,různé,9,Kdo souhlasí s odkupem části pozemku č. 258/102 za uvedených podmínek?,
7012,7,2011-12-19,různé,9,Kdo souhlasí s prodejem pozemků v k.ú. Doksy za uvedených podmínek?,
7013,7,2011-12-19,různé,9,Kdo souhlasí s uzavřením smlouvy o zřízení věcného břemene - cyklostezka,
7014,7,2011-12-19,různé,9,Kdo souhlasí s uvedeným záměrem-NÁVRH NA SCHVÁLENÍ ZÁMĚRU OBCE NA OSLOVENÍ ZHOTOVITELŮ NA VÝMĚNU SVÍTIDEL VEŘEJNÉHO OSVĚTLENÍ,
7015,7,2011-12-19,usnesení a závěr,11,Kdo souhlasí s navrženým usnesením,
8001,8,2012-03-19,program,1,hlasování o programu,
8002,8,2012-03-19,NÁVRH 1. ZMĚNY ROZPOČTU NA ROK 2012,4,Kdo souhlasí s 1. změnou rozpočtu obce na r. 2012,
8003,8,2012-03-19,různé,5,"Kdo souhlasí s uzavřením smlouvy s firmou „Zakládání a údržba zeleně za 129.940,— Kč vč. DPH",
8004,8,2012-03-19,různé,5,Kdo souhlasí se zveřejněním záměru obce pronajmout hřiště vč. nemovitého a movitého majetku,
8005,8,2012-03-19,různé,5,Kdo souhlasí se zřízením parkoviště na pozemku č. 258/115 nákladem do 500 tis. Kč?,
8006,8,2012-03-19,různé,5,Kdo souhlasí se zahájením práce na tomto novém dotačním titulu na dovybavením sběrného místa,
8007,8,2012-03-19,různé,5,"Kdo souhlasí s uzavřením smluv o zřízení věc, břemene s Vesetou, s p. Adamem a pí. Kyliášovou",
8008,8,2012-03-19,různé,5,"Kdo souhlasí s odkupem pozemku č. 245/7 za cenu 20.000,- Kč?",
8009,8,2012-03-19,různé,5,Kdo je pro zřízení záměru na revitalizaci braškovského potoka,
8010,8,2012-03-19,usnesení a závěr,7,Kdo souhlasí s navrženým usnesením,
9001,9,2012-06-25,program,1,hlasování o programu,
9002,9,2012-06-25,ZÁVĚREČNÝ ÚČET OBCE ZA ROK 2011 A VÝSLEDEK AUDITU,3,Kdo souhlasí abychom závěrečný účet obce za r. 2011 vč. zprávy o výsledku přezkoumání hospodaření obce schválili,
9003,9,2012-06-25,NÁVRH 2. ZMĚNY ROZPOČTU NA ROK 2012,5,Kdo souhlasí s 2. změnou rozpočtu obce na r. 2012?,
9004,9,2012-06-25,různé,7,Kdo souhlasí s odkupem a bezúplatným převodem uvedených pozemků na Toskánce?,
9005,9,2012-06-25,různé,7,Kdo souhlasí s výsledkem výběrového řízení a výběrem firmy Consult s.r.o.?,
9006,9,2012-06-25,různé,7,Kdo souhlasí s uzavřením smlouvy o pronájmu fotbalového hřiště vč. smluv o dotaci?,
9007,9,2012-06-25,různé,7,Kdo souhlasí s uzavřením dohody o změně VPS s Městem Unhošť?,
9008,9,2012-06-25,různé,7,"Kdo souhlasí s uzavřením kupní smlouvy na pozemek p.č. 50/2 za 71.460,— Kč?",
9009,9,2012-06-25,diskuze,8,Kdo souhlasí s realizací záměru na přestavbu půdy na klubovnu?,
9010,9,2012-06-25,usnesení a závěr,9,Kdo souhlasí s navrženým usnesením,
10001,10,2012-09-19,program,1,hlasování o programu,
10002,10,2012-09-19,KONTROLA PLNĚNÍ USNESENÍ 8. ZASEDÁNÍ ZASTUPITELSTVA,2,"Kdo souhlasí, abychom vzali informaci o kontrole plnění usnesení 8. zaseádní na vědomí?",
10003,10,2012-09-19,ZPRÁVA O FINANČNÍM HOSPODAŘENÍ OBCE K 31.8.2012,3,Kdo souhlasí se zprávou o stavu hospodaření obce k 31.8.2012?,
10004,10,2012-09-19,STAV A PRŮBĚH AKCÍ ..PROGRAMU ROZVOJE OBCE',4,"Kdo souhlasí, abychom uvedenou zprávu vzali na vědomí?",
10005,10,2012-09-19,DOHODA O ZMĚNĚ VEŘEJNOPRÁVNÍ SMLOUVY S MĚSTEM UNHOŠŤ,5,Kdo souhlasí s uzavřením dohody o změně veřejnoprávní smlouvy s Městem Unhošť?,
10006,10,2012-09-19,MAJETKOPRÁVNÍ ZÁLEŽITOSTI,6,Kdo souhlasí s předloženým návrhem na majetkoprávní řešení?,
10007,10,2012-09-19,různé,7,"Kdo souhlasí, aby byla kornikářka Vyplelová nahrazena Pavlem Stádeníkem?",
10008,10,2012-09-19,různé,7,"Kdo souhlasí, aby rada obce pokračovala v přípravě uvedených záměrů a objednala studii na podium do 40 tis. Kč?",
10009,10,2012-09-19,různé,7,Kdo souhlasí s úhradou nákladů na pořízení busty?,
10010,10,2012-09-19,různé,7,Kdo souhlasí s poskytnutím sponzorského daru obce ve výši 50.000.— Kč?,
10011,10,2012-09-19,různé,7,Kdo souhlasí s provedením opravy MŠ v rozsahu max 50 tisíc korun?,
10012,10,2012-09-19,různé,7,Kdo souhlasí s provedením opravy ordinace v daném rozsahu,
10013,10,2012-09-19,různé,7,Kdo souhlasí s uzavřením předložené smlouvy? - ULICE KRÁTKÁ - SMLOUVA S ČEZ O ZŘÍZENÍ VĚCNÉHO BŘEMENE,
10014,10,2012-09-19,různé,7,Kdo souhlasí s uzavřením uvedených mandátních smluv? - CHODNÍK BRÁŠKOV-KYŠICE A TOSKÁNKA - BEZPEČNOSTÍ ŘEŠENÍ - MANDÁTNÍ SMLOUVY,
10015,10,2012-09-19,různé,7,Kdo souhlasí s předloženým návrhem usnesení o výběru zhotovitele chodníku Braškov-Kyšice,
10016,10,2012-09-19,různé,7,Kdo souhlasí s předloženým záměrem na využití půdního prostoru budovy OÚ,
10017,10,2012-09-19,různé,7,Kdo souhlasí s uzavřením uvedených dodatků smluv o spolupráci při zabezpečení požární ochrany,
10018,10,2012-09-19,usnesení a závěr,9,Kdo souhlasí s navrženým usnesením,
11001,11,2012-12-17,program,1,hlasování o programu,
11002,11,2012-12-17,KONTROLA PLNĚNÍ USNESENÍ 9. ZASEDÁNÍ ZASTUPITELSTVA,2,"Kdo souhlasí, abychom vzali informaci o kontrole plnění usnesení 8. zaseádní na vědomí?",
11003,11,2012-12-17,ZPRÁVA O FINANČNÍM HOSPODAŘENÍ OBCE K 30.11.2012,3,Kdo souhlasí se zprávou o stavu hospodaření obce k 30.11.2012?,
11004,11,2012-12-17,ZPRÁVA O VÝSLEDKU DÍLČÍHO PŘEZKOUMÁNÍ HOSPODAŘENÍ OBCE ZA ROK 2012,4,"Kdo souhlasí, abychom uvedenou zprávu vzali na vědomí?",
11005,11,2012-12-17,NÁVRH 3. ZMĚNY ROZPOČTU OBCE NA ROK 2012,5,Kdo souhlasí s předloženou 3. změnou rozpočtu na rok 2012?,
11006,11,2012-12-17,NÁVRH ROZPOČTU OBCE NA ROK 2013,6,Kdo souhlasí s předloženým návrhem rozpočtu obce na r. 2013?,
11007,11,2012-12-17,STAV A PRŮBĚH AKCÍ PROGRAMU ROZVOJE OBCE,7,"Kdo souhlasí, abychom uvedenou zprávu vzali na vědomí?",
11008,11,2012-12-17,různé,8,Kdo souhlasí s uzavřením smlouvy s Geodetickou kanceláří Bílek - Vydra?,
11009,11,2012-12-17,různé,8,Kdo souhlasí s uvedeným záměrem a uzavřením smlouvy na zpracování dokumentace s p. Prynychem?,
11010,11,2012-12-17,různé,8,Kdo souhlasí s uvedeným záměrem na pozemku č. 24/5?,
11011,11,2012-12-17,různé,8,Kdo souhlasí se změnou v systému při likvidaci velkoobjemového a biologického odpadu podle návrhu?,
11012,11,2012-12-17,různé,8,Kdo souhlasí s prodejem a uzavřením kupní smlouvy s ŘSD na pozemek č. 1471/2?,
11013,11,2012-12-17,různé,8,Kdo souhlasí s předloženým architektonickým návrhem na stavbu podia na Háji,
11014,11,2012-12-17,různé,8,Kdo souhlasí se záměrem a s uzavřením smlouvy na jeho realizaci podle nabídky p. J. Votavy-REKONSTRUKCE ČÁSTI VEŘ. OSVĚTLENÍ V UL. SPORTOVCŮ?,
11015,11,2012-12-17,různé,8,Kdo souhlasí s uzavřením předložený smluv s TJ Sokol Braškov,
11016,11,2012-12-17,různé,8,Kdo souhlasí s uzavřením smlouvy o budoucí kupní smlouv,
11017,11,2012-12-17,různé,8,Kdo souhlasí s úhradou provozních nákladů hřbitova ve výši 38.257.25 Kč,
11018,11,2012-12-17,různé,8,Kdo souhlasí s úhradou víceprací OÚ ve výši 380 tis. Kč,
11019,11,2012-12-17,usnesení a závěr,10,Kdo souhlasí s navrženým usnesením,
12001,12,2013-03-25,program,1,hlasování o programu,
12002,12,2013-03-25,KONTORLA PLNĚNÍ USNESENÍ 10. ZASEDÁNÍ ZASTUPITELSTVA,2,"Kdo souhlasí, abychom vzali informaci o kontrole plnění usnesení 10. zasedání na vědomí",
12003,12,2013-03-25,VÝSLEDEK HOSPODAŘENÍ OBCE K 31.12.2012,3,"Kdo souhlasí, abychom vzali zprávu o výsledku hospodaření obce k 31.12.2012 na vědomí",
12004,12,2013-03-25,NÁVRH 1. ZMĚNY ROZPOČTU NA ROK 2013,4,Kdo souhlasí s 1. změnou rozpočtu obce pro rok 2013,
12005,12,2013-03-25,ÚČETNÍ ODPISOVÝ PLÁN NA ROK 2013,5,Kdo souhlasí s odpisovým plánem na rok 2013?,
12006,12,2013-03-25,PROGRAM VÝSTAVBY,6,Kdo souhlasí s předloženým návrhem,
12007,12,2013-03-25,PROJEDNÁNÍ NÁVRHŮ SMLUV A VÝSLEDKŮ VÝBĚROVÝCH ŘÍZEN,7,Kdo souhlasí s uzavřením smlouvy podle nabídky ing. Koloucha?,
12008,12,2013-03-25,PROJEDNÁNÍ NÁVRHŮ SMLUV A VÝSLEDKŮ VÝBĚROVÝCH ŘÍZEN,7,Kdo souhlasí s uzavřením smlouvy podle nabídky p. Prynycha?,
12009,12,2013-03-25,PROJEDNÁNÍ NÁVRHŮ SMLUV A VÝSLEDKŮ VÝBĚROVÝCH ŘÍZEN,7,Kdo souhlasí s uzavřením smlouvy na zastřešení dvora OÚ?,
12010,12,2013-03-25,PROJEDNÁNÍ NÁVRHŮ SMLUV A VÝSLEDKŮ VÝBĚROVÝCH ŘÍZEN,7,Kdo souhlasí s uzavřením smlouvy podle nabídky Ing. Křižáka?,
12011,12,2013-03-25,PROJEDNÁNÍ NÁVRHŮ SMLUV A VÝSLEDKŮ VÝBĚROVÝCH ŘÍZEN,7,Kdo souhlasí s uzavřením smlouvy podle předložené nejvýhodnější nabídky?,
12012,12,2013-03-25,PROJEDNÁNÍ NÁVRHŮ SMLUV A VÝSLEDKŮ VÝBĚROVÝCH ŘÍZEN,7,Kdo souhlasí s uzavřením předloženého návrhu smlouvy s Mgr. Vidunou?,
12013,12,2013-03-25,PROJEDNÁNÍ NÁVRHŮ SMLUV A VÝSLEDKŮ VÝBĚROVÝCH ŘÍZEN,7,"Kdo souhlasí, aby firma Teren Design udělala studii na revitalizaci Brašk. potoka za 75 tis. Kč?",
12014,12,2013-03-25,různé,8,Kdo souhlasí s uzavřením předloženého návrhu kupní smlouvy - NÁVRH SMLOUVY AELIA PRQPERTY S.R.O. NA ODKUP POZEMKU,
12015,12,2013-03-25,různé,8,Kdo souhlasí s uzavřením předložené smlouvy -NÁVRH SMLOUVY NA ÚDRŽBU VEŘEJNÉ ZELENĚ,
12016,12,2013-03-25,různé,8,Kdo souhlasí se žádostí o bezúplatný převod uvedené části pozemku č. 390/1?,
12017,12,2013-03-25,různé,8,Kdo souhlasí s uzavřením předložené smlouvy o dotaci - SMLOUVA O POSKYTNUTÍ DOTACE TJ SOKOL BRÁŠKO V,
12018,12,2013-03-25,různé,8,"Starosta sdělil, že rada obce navrhuje pro novou komunikaci název „U Hřiště",
12019,12,2013-03-25,různé,8,"Kdo souhlasí s tím, abychom všemi zákonnými prostředky vymítili VHA v naší obci ?",
12020,12,2013-03-25,diskuze,9,Kdo je s tím daným stavem odpadového hospodářství spokojený,
12021,12,2013-03-25,usnesení a závěr,10,Kdo souhlasí s navrženým usnesením,
13001,13,2013-06-24,program,1,hlasování o programu,
13002,13,2013-06-24,KONTROLA PLNĚNÍ USNESENÍ 11. ZASEDÁNÍ ZASTUPITELSTVA,2,"Kdo souhlasí, abychom vzali informaci o kontrole plnění usnesení 11. zasedání na vědomí?",
13003,13,2013-06-24,ZÁVĚREČNÝ ÚČET OBCE ZA ROK 2012 A VÝSLEDEK AUDITU,3,"Kdo souhlasí, abychom závěrečný účet oce včetně zprávy o výsledku přezkoumání hospodaření obce za rok 2012 schválili bez výhrady",
13004,13,2013-06-24,SCHVÁLENÍ ÚČETNÍ ZÁVĚRKY ZA ROK 2012,4,Kdo souhlasí se schválením účetní závěrky za rok 2012?,
13005,13,2013-06-24,ZPRÁVA O FINANČNÍM HOSPODAŘENÍ OBCE K 31.5.2013,5,"Kdo souhlasí, abychom vzali výsledek hospodaření obce k 31.5.2013 s uspokojením na vědomí?",
13006,13,2013-06-24,SCHVÁLENÍ ÚZEMNÍHO PLÁNU OBCE,6,Kdo souhlasí se schválením Územního plánu obce Braškov?,
13007,13,2013-06-24,STAV A PRŮBĚH AKCÍ „PROGRAMU VÝSTAVBY',7,Kdo souhlasí se schválením předloženého návrhu „Programu výstavby'?,
13008,13,2013-06-24,různé,8,Kdo souhlasí se schválením uvedené vyhlášky č. 1/2013,
13009,13,2013-06-24,různé,8,"Kdo souhlasí, aby obec zveřejnila záměr na prodej uvedené části pozemku č. 11/15?",
13010,13,2013-06-24,různé,8,Kdo souhlasí s odkoupením pozemku p.č. 61/17,
13011,13,2013-06-24,různé,8,Kdo souhlasí s uzavřením předloženého návrhu směnné smlouvy s L E S Y ČR?,
13012,13,2013-06-24,různé,8,Kdo souhlasí s uzavřením smlouvy NA ZPRACOVÁNÍ STUDIE CHODNÍKU VALDEK-VELKÁ DOBRÁ,
13013,13,2013-06-24,různé,8,Kdo souhlasí se záměrem na realizaci chodníků v části obce Toskánka,
13014,13,2013-06-24,různé,8,Kdo souhlasí s volbou ing. K. Dolejšové do rady obce,
13015,13,2013-06-24,různé,8,Kdo souhlasí s uzavřením dílčích smluv s firmou M-Finance s.r.o.?,
13016,13,2013-06-24,různé,8,Kdo souhlasí s uzavřením smlouvy se SPF Group v.o.s.?,
13017,13,2013-06-24,různé,8,Kdo souhlasí s uzavřením předložené mandátní smlouvy se spol. WITERO s.r.o.?,
13018,13,2013-06-24,různé,8,Kdo souhlasí s uzavřením předložené smlouvy na projekt na rekonstrukci MS,
13019,13,2013-06-24,různé,8,Kdo souhlasí s vyhlášením výběrového řízení na pozici správce - tech. pracovníka,
13020,13,2013-06-24,různé,8,Kdo souhlasí s uzavřením předložené smlouvy O UZAVŘENÍ BUDOUCÍ SMLOUVY O DÍLO NA ZPRACOVÁNÍ PROJEKTOVÉ DOKUMENTACE „REVITALIZACE BRÁŠKOVSKÉHO POTOKA,
13021,13,2013-06-24,usnesení a závěr,10,Kdo souhlasí s navrženým usnesením č. 1,
13022,13,2013-06-24,usnesení a závěr,10,Kdo souhlasí s navrženým usnesením č. 2,
14001,14,2013-09-02,program,1,hlasování o programu,
14002,14,2013-09-02,KONTROLA PLNĚNÍ USNESENÍ 12. ZASEDÁNÍ ZASTUPITELSTVA,2,"Kdo souhlasí, abychom vzali informaci o kontrole plnění usnesení 12. zasedání na vědomí",
14003,14,2013-09-02,ZPRÁVA O FINANČNÍM HOSPODAŘENÍ OBCE K 31.7.2013,3,"Kdo souhlasí, abychom vzali výsledek hospodaření obce k 31.7.2013 s upokojením na vědomí?",
14004,14,2013-09-02,SCHVÁLENÍ 3. ZMĚNY ROZPOČTU OBCE NA R. 2013,4,Kdo souhlasí se schválením 3. změny rozpočtu obce na r. 2013?,
14005,14,2013-09-02,STAV A PRŮBĚH AKCÍ „PROGRAMU VÝSTAVBA,5,Kdo souhlasí se schválením aktualizovaného návrhu „Programu výstavby',
14006,14,2013-09-02,SCHVÁLENÍ VÝSLEDKŮ VÝBĚROVÝCH ŘÍZENÍ,6,Kdo souhlasí s předloženými výsledky výběrových řízení a uzavřením smluv v souladu s jejich výsledky?,
14007,14,2013-09-02,různé,7,Kdo souhlasí s přijetím dotace na akci Rekreační a izolační zeleň Toskánka a jejím kofinancováním z rozpočtu obce?,
