id,legislative_session:number,start_date,item:title,item:number,motion:title,
15012,15,2014-04-24,ZO schválilo,12,"Zastupitelstvo obce Rochlov vyřazuje z evidence majetku stolní PC, které bylo
pořízeno pro pracoviště CZECHPOINT. Toto PC bude zlikvidováno jako
vyřazený elektrospotřebič.",
15013,15,2014-04-24,ZO schválilo,13,Zastupitelstvo obce Rochlov schvaluje rozpočtové opatření č.1/2014 dle přílohy
Č.7/VZ29.,
17001,17,2014-07-28,ZO schválilo,1,Zastupitelstvo obce Rochlov projednalo a schvaluje bezúplatný převod pozemků od
Státního pozemkového úřadu a to pozemků č.399/15 a 399/14 v k. ú. Rochlov.,
17002,17,2014-07-28,ZO schválilo,2,"Zastupitelstvo obce Rochlov revokuje usnesení č. 282/14 ze dne 26.6.2014 a schvaluje
poskytnutí daru ve výši 15.000,-Kč Stodské nemocnici, a.s. pro gynekologicko-porodnické
oddělení na nákup 3D ultrazvuku.",
17003,17,2014-07-28,ZO schválilo,3,Zastupitelstvo obce Rochlov ruší fond «a DČOVa zbyléfinančníprostředky převede
na účet zřízený u ČSOB.,
17004,17,2014-07-28,ZO schválilo,4,"Zastupitelstvo obce Rochlov projedná na pracovní schůzce zastupitelů dne 4.8.2014
přípravu hlukové vyhlášky, která by časově omezovala některé vykonávané, hlukem rušící
činnosti. O výsledku bude informovat starosta na dalším VZ.",
17005,17,2014-07-28,ZO ukládá,5,"Zastupitelstvo obce Rochlov projedná na pracovní schůzce zastupitelů dne 4.8.2014
přípravu hlukové vyhlášky, která by časově omezovala některé vykonávané, hlukem rušící
činnosti. O výsledku bude informovat starosta na dalším VZ.",
18001,18,2014-09-18,ZO schválilo,1,"Zastupitelstvo obce Rochlov schvaluje Výzvu občanům k omezení hluku. Dále
pověřuje starostu, aby tuto výzvu zveřejnit formou letáků všem občanům do
schránky a vyhlásil v místním rozhlase a formou SMS",
18002,18,2014-09-18,ZO schválilo,2,Zastupitelstvo obce Rochlov revokuje usnesení č. 208/,
18003,18,2014-09-18,ZO schválilo,3,Zastupitelstvo obce Rochlov schvaluje umístěni reklamního poutače bez laviček
na návsi na pravou stranu od památníku,
18004,18,2014-09-18,ZO schválilo,4,"Zastupitelstvo obce Rochlov schvaluje poskytnutí příspěvku na DČOVpro paní
Oldřišku Čejkovou ve výši 20000,-Kč",
18005,18,2014-09-18,ZO schválilo,5,"Zastupitelstvo obce Rochlov schvaluje odkup nemovitosti v k.ú. Rochlov stp.č. 22/20
- 122 m' za cenu 50000,-Kč + poplatků s tím souvisejících",
18006,18,2014-09-18,ZO schválilo,6,"Zastupitelstvo obce Rochlov schvaluje odkup části pozemku č. 22/1 v k.ú. Rochlov
do 150 m" za cenu 280,-Kč/l m~ a poplatků s tím souvisejících. Dále Obec Rochlov
uhradí náklady za přesun oplocení. Zajistí změnu užívání pozemku ze zahrady na
místní komunikaci a zřízeni předkupního práva pro paní Kaslovou v případě, že
bychom chtěli nově koupené pozemky prodat",
19001,19,2014-09-19,ZO schválilo,7,Zastupitelstvo obce Rochlov schvaluje rozpočtové opatření č.4/2014 dle přílohy
Č.5/VZ33.,
16001,16,2014-07-26,ZO schválilo,1,"Zastupitelstvo obce Rochlov schvaluje bez výhrad Povodňový plán obce Rochlov,
vypracovaný ve spolupráci s f. ENVIPARTNER s.r.o. v rámci projektu Místní
informační systém a povodňový plán Rochlov.",
16002,16,2014-07-26,ZO schválilo,2,"Zastupitelstvo obce Rochlov schvaluje odprodej pozemku č. 723/18 - travní porost
v k.ú. Rochlov o celkové výměře 81m2 p. Jiřímu Pechovi, U Poradny 9, 330 00
Plzeň, za cenu 100,-Kč/lm2 a poplatků s tímto prodejem spojených",
16003,16,2014-07-26,ZO schválilo,3,"Zastupitelstvo obce Rochlov schvaluje vytvoření pracovní příležitosti v rámci VPPa
poskytnutí příspěvku 11.390,-Kč/měsíc pro obec Rochlov za druhé pracovní místo",
16004,16,2014-07-26,ZO schválilo,4,"Zastupitelstvo obce Rochlov schvaluje přijetí daru ve výši 5.000,-Kč od f. In kasta
s.r.o., 1.000,-Kč od f. Beránek Bohemia s.r.o. a 5.805,- od občanů obce Rochlov",
16005,16,2014-07-26,ZO schválilo,5,"Zastupitelstvo obce Rochlov schvaluje poskytnutí daru ve výši 15.000,-Kč Nemocnici
Stod a.s. za účelem pořízení CT.",
16006,16,2014-07-26,ZO schválilo,6,"Zastupitelstvo obce Rochlov potvrzuje do funkce ředitelky MŠ Rochlov, okres Plzeň
- sever příspěvková organizace MgrJanu Šauerovou na dalších 6 let",
16007,16,2014-07-26,ZO schválilo,7,Zastupitelstvo obce Rochlov schvaluje zápis do obecní kroniky za rok,
16008,16,2014-07-26,ZO schválilo,8,Zastupitelstvo obce Rochlov schvaluje dle § 67 a 68 zákona o obcích č.
128/2000Sb.t počet členů Zastupitelstva pro volební období 2014 - 2018 na 7.
členů.,
16009,16,2014-07-26,ZO schválilo,9,"Zastupitelstvo obce Rochlov schvaluje Obecně závaznou vyhlášku č. 1/2014 kterou se
mění a doplňuje OZVo volném pohybu psů č.2/2009. Dále pověřit starostu, aby
připravil informaci pro občany a tuto informaci vhodným způsobem zveřejnil",
16010,16,2014-07-26,ZO schválilo,10,"Zastupitelstvo obce Rochlov pověřuje starostu, aby zjistil přesné informace a
podmínky elektronické aukce na dodavatele elektrické energie pro Obec Rochlov a
Mateřskou školu Rochlov.",
16011,16,2014-07-26,ZO schválilo,11,Zastupitelstvo obce Rochlov schvaluje rozpočtové opatření č.3/2014 dle přílohy
Č.S/VZ3L,
